FACULDADE SERRA DO CARMO (FASEC),FASEC,Quadra 103 Norte Rua de Pedestre No-03 - 26 Centro,Palmas,TO
Faculdade Serra Dourada,-,Avenida Novo Horizonte - 214 Residencial Cidade Nova,Altamira,PA
FACULDADE SERRA GERAL (FASG),FASG,RUA DOM ARISTIDES - 70 CENTRO,Janaúba,MG
FACULDADE SERRANA DE SAÚDE (FASS),FASS,RUA BOANERGES DE ALMEIDA PINHEIRO - 1144 CENTRO,Itabaiana,SE
FACULDADE SESI-SP DE EDUCAÇÃO (FASESP),FASESP,Rua Carlos Weber - 835 Vila Leopoldina,São Paulo,SP
Faculdades EST (EST),EST,Rua Amadeo Rossi - 467 Morro do Espelho,São Leopoldo,RS
FACULDADE SETE DE SETEMBRO (FASETE),FASETE,Rua Vereador José Moreira - 1000 Perpétuo Socorro,Paulo Afonso,BA
FACULDADE SETELAGOANA DE CIÊNCIAS GERENCIAIS (FASCIG),FASCIG,Avenida Marechal Castelo Branco - 3870 Jardim Universitário,Sete Lagoas,MG
FACULDADE SETE LAGOAS (FACSETE),FACSETE,Rua Itália Pontelo - 50 Chácara do Paiva,Sete Lagoas,MG
FACULDADES EVANGÉLICAS INTEGRADAS CANTARES DE SALOMÃO (FEICS),FEICS,Av Historiador Rubens de Mendonça - 3500 Paiaguás,Cuiabá,MT
FACULDADE SHALOM DE ENSINO SUPERIOR (FASES),FASES,Rua Joaquim Leal de Camargos - 220 Planalto,Uberlândia,MG
Faculdades IDAAM (IDAAM),IDAAM,Avenida Djalma Batista - 1719 Chapada,Manaus,AM
Faculdades Impactos Brasil (FACIB),FACIB,Rua Almirante Pedro Álvares Cabral - 510 Jardim Cuiabá,Cuiabá,MT
FACULDADE SINERGIA (SINERGIA),SINERGIA,Avenida Prefeito Cirino Adolfo Cabral - 199 São Pedro,Navegantes,SC
FACULDADE SINOP (FASIP),FASIP,Avenida Magda Cassia Pissinatti - 69 Residencial Florença,Sinop,MT
FACULDADES INTEGRADAS ADVENTISTAS DE MINAS GERAIS (FADMINAS),FADMINAS,Rua Joaquim Gomes Guerra - 590 Keneddy,Lavras,MG
FACULDADES INTEGRADAS ANGLO-AMERICANO (FIAA),FIAA,AV. PARANÁ - 5661 VILA A,Foz do Iguaçu,PR
Faculdades Integradas Aparício Carvalho Vilhena (FIMCAVILHENA),FIMCAVILHENA,Rua Marques henrique - 625 entro,Vilhena,RO
FACULDADES INTEGRADAS ASMEC (ASMEC),ASMEC,Avenida Prof. Dr. Antônio Eufrásio de Toledo - 100 Jardim dos Ipês,Ouro Fino,MG
FACULDADES INTEGRADAS BARROS MELO (FIBAM),FIBAM,Avenida Transamazônica - 405 Jardim Brasil II,Olinda,PE
FACULDADES INTEGRADAS CAMÕES (FICA),FICA,Avenida Jaime Reis - 531 Alto São Francisco,Curitiba,PR
FACULDADES INTEGRADAS CAMPO-GRANDENSES (FIC),FIC,Estrada da Caroba - 685 Campo Grande,Rio de Janeiro,RJ
FACULDADES INTEGRADAS CAMPOS SALLES (FICS),FICS,Rua Nossa Senhora da Lapa - 284 Lapa,São Paulo,SP
FACULDADES INTEGRADAS CESUMAR (CESUMAR),CESUMAR,Avenida Doutor Vicente Machado - 585 Centro,Ponta Grossa,PR
FACULDADES INTEGRADAS CESUMAR DE ARAPONGAS (CESUMAR),CESUMAR,Rua Falcão - 768 Centro,Arapongas,PR
FACULDADES INTEGRADAS CESUMAR DE CURITIBA (CESUMAR),CESUMAR,Rua Itajubá - 673 Portão,Curitiba,PR
FACULDADES INTEGRADAS CESUMAR DE GUARAPUAVA (CESUMAR),CESUMAR,Rua Quinze de Novembro - 6198 Alto da XV,Guarapuava,PR
FACULDADES INTEGRADAS CESUMAR DE LONDRINA (CESUMAR),CESUMAR,Avenida Celso Garcia Cid - 1523 Vila Siam,Londrina,PR
FACULDADES INTEGRADAS CORAÇÃO DE JESUS (FAINC),FAINC,Rua Siqueira Campos - 483 CENTRO,Santo André,SP
FACULDADES INTEGRADAS DA AMÉRICA DO SUL (FAC INTEGRA),FAC INTEGRA,Av. Presidente Geisel - S/N Lagoa Quente,Caldas Novas,GO
FACULDADES INTEGRADAS DA UNIÃO DE ENSINO SUPERIOR CERTO (UNICERTO),UNICERTO,Setor D Sul Área Especial 516 - 516 Taguatinga -,Brasília,DF
FACULDADES INTEGRADAS DA UPIS (UPIS),UPIS,SEPS EQ 712/912 - S/N ASA SUL,Brasília,DF
FACULDADES INTEGRADAS DA VITÓRIA DE SANTO ANTÃO (FAINTVISA),FAINTVISA,Loteamento São Vicente Ferrer - 71 Cajá,Vitória de Santo Antão,PE
FACULDADES INTEGRADAS DE ARACRUZ (FAACZ),FAACZ,Rua Professor Berilo Basílio dos Santos - 180 Centro,Aracruz,ES
FACULDADES INTEGRADAS DE ARARAQUARA (FIAR),FIAR,Avenida Brasil - 782 Centro,Araraquara,SP
FACULDADES INTEGRADAS DE ARIQUEMES (FIAR),FIAR,Avenida Guaporé - 3577 Setor 06,Ariquemes,RO
FACULDADES INTEGRADAS DE BAURU (FIB),FIB,Rua Rodolfina Dias Domingues - 11 Jardim Ferraz,Bauru,SP
FACULDADES INTEGRADAS DE BOTUCATU,-,Avenida Leonardo Villas Boas - 351 Vila Nova Botucatu,Botucatu,SP
FACULDADES INTEGRADAS DE CACOAL (UNESC),UNESC,Rua dos Esportes - 1038 Incra,Cacoal,RO
FACULDADES INTEGRADAS DE CASSILÂNDIA (FIC),FIC,Av.Presidente Dutra - 1500 CENTRO,Cassilândia,MS
FACULDADES INTEGRADAS DE CATAGUASES (FIC),FIC,Rua Romualdo Menezes - 701 Menezes,Cataguases,MG
"FACULDADES INTEGRADAS DE CIÊNCIAS HUMANAS, SAÚDE E EDUCAÇÃO DE GUARULHOS (FG)",FG,Rua Barão de Mauá - 95 Centro,Guarulhos,SP
FACULDADES INTEGRADAS DE DIAMANTINO (FID),FID,RUA ALMIRANTE BATISTA DAS NEVES - 1112 CENTRO,Diamantino,MT
FACULDADES INTEGRADAS DE FERNANDÓPOLIS (FIFE),FIFE,Avenida Teotônio Vilela - s/n Campus Universitário,Fernandópolis,SP
FACULDADES INTEGRADAS DE GARANHUNS (FACIGA),FACIGA,AVENIDA CARUARU - 508 SÃO JOSÉ,Garanhuns,PE
FACULDADES INTEGRADAS DE ITAPETININGA (FII),FII,Rodovia Raposo Tavares KM 162 - S/N Nova Itapetininga,Itapetininga,SP
FACULDADES INTEGRADAS DE ITARARÉ (FAFIT-FACIC),FAFIT-FACIC,Rua João Batista Veiga - 1.725 Cruzeiro,Itararé,SP
FACULDADES INTEGRADAS DE JACAREPAGUÁ (FIJ),FIJ,Ladeira da Freguesia - 196 Jacarepagua,Rio de Janeiro,RJ
FACULDADES INTEGRADAS DE JAHU (FIJ),FIJ,Rua Tenente Navarro - 642 CHACARA MIRAGLIA,Jaú,SP
FACULDADES INTEGRADAS DE NAVIRAÍ (FINAV),FINAV,Rua Laurentino Pires de Arruda - 220 Jardim Progresso,Naviraí,MS
FACULDADES INTEGRADAS DE PARANAÍBA - FIPAR (FIPAR),FIPAR,Rua Maclino de Queiroz - 270 Jardim Redentora,Paranaíba,MS
FACULDADES INTEGRADAS DE PATOS (FIP),FIP,Avenida Floriano Peixoto - 3333 Santa Rosa,Campina Grande,PB
FACULDADES INTEGRADAS DE PONTA PORÃ (FIP),FIP,Rua Tiradentes - 322 Centro,Ponta Porã,MS
FACULDADES INTEGRADAS DE RONDONÓPOLIS (FAIR),FAIR,Rua Arnaldo Estevao de Figueiredo - 758 Centro,Rondonópolis,MT
FACULDADES INTEGRADAS DE SÃO PAULO (FISP),FISP,Rua Tagua - 150 Liberdade,São Paulo,SP
Faculdades Integradas Desembargador Sávio Brandão (FAUSB),FAUSB,Rua Arthur Bernardes - s/n IPASE,Várzea Grande,MT
FACULDADES INTEGRADAS DE SERGIPE (FISE),FISE,Rua Largo do Glicerino Cerqueira - 387 Centro,Tobias Barreto,SE
Faculdades Integradas de Taguaí (FIT),FIT,Rua das Acácias - 110 Jardim Primavera I,Taguaí,SP
FACULDADES INTEGRADAS DE TANGARÁ DA SERRA (FITS),FITS,Avenida Vergilio Favetti - 1200 Vila Alta,Tangará da Serra,MT
FACULDADES INTEGRADAS DE TAQUARA (FACCAT),FACCAT,Avenida Oscar Martins Rangel - 4500 Fogão Gaúcho,Taquara,RS
FACULDADES INTEGRADAS DE TRÊS LAGOAS (AEMS),AEMS,Avenida Ponta Porã - 2750 Distrito Industrial,Três Lagoas,MS
FACULDADES INTEGRADAS DO BRASIL UNIFUTURO (Faculdade Unifuturo),Faculdade Unifuturo,Avenida Odon Bezerra - 184 Tambiá,João Pessoa,PB
FACULDADES INTEGRADAS DO CEARÁ (FIC),FIC,Rua Julio Cavalcante - 34 Areias I,Iguatu,CE
FACULDADES INTEGRADAS DO EXTREMO SUL DA BAHIA (UNESULBAHIA),UNESULBAHIA,"Rod. Br 367, Km 14 - s/n Zona Rural",Eunápolis,BA
FACULDADES INTEGRADAS DOM PEDRO II (DOMPEDRO),DOMPEDRO,AVENIDA BADY BASSITT - 3777 IMPERIAL,São José do Rio Preto,SP
FACULDADES INTEGRADAS DO NORTE DE MINAS - FUNORTE (FUNORTE),FUNORTE,Rua Lírio Brant - 787 Melo,Montes Claros,MG
Faculdades Integradas do Rio Grande do Norte - FANORTES,-,Praça Pedro Ii - 1055 Alecrim,Natal,RN
FACULDADES INTEGRADAS DOS CAMPOS GERAIS (CESCAGE),CESCAGE,Avenida General Carlos Cavalcanti - s/n Uvaranas,Ponta Grossa,PR
FACULDADES INTEGRADAS DO VALE DO IVAÍ,-,Avenida Minas Gerais - 651 Centro,Ivaiporã,PR
FACULDADES INTEGRADAS EINSTEIN DE LIMEIRA (FIEL),FIEL,Rua Raul Machado - 134 Vila Queiroz,Limeira,SP
FACULDADES INTEGRADAS ESPÍRITA (FIES),FIES,Rua Tobias de Macedo Júnior - 246 Santo Inácio,Curitiba,PR
FACULDADES INTEGRADAS HÉLIO ALONSO (FACHA),FACHA,Rua Muniz Barreto - 51 Botafogo,Rio de Janeiro,RJ
FACULDADES INTEGRADAS IESGO (IESGO),IESGO,Avenida Brasília - 2001 Formosinha,Formosa,GO
FACULDADES INTEGRADAS IPEP (FIPEP),FIPEP,Rua Pirapitingui - 186 Liberdade,São Paulo,SP
FACULDADES INTEGRADAS IPIRANGA (FAINTIPI),FAINTIPI,Avenida Almirante Barroso - 777 Marco,Belém,PA
FACULDADES INTEGRADAS IPITANGA (FACIIP),FACIIP,Avenida Luiz Tarquínio - s/n Pitangueiras,Lauro de Freitas,BA
FACULDADES INTEGRADAS MACHADO DE ASSIS (FEMA),FEMA,Rua Rua Santos Dumont - 820 Centro,Santa Rosa,RS
FACULDADES INTEGRADAS MARIA IMACULADA (FIMI),FIMI,Rua Paula Bueno - 240 Centro,Mogi Guaçu,SP
FACULDADES INTEGRADAS MARIA THEREZA (FAMATH),FAMATH,Avenida Visconde do Rio Branco - 869 Centro,Niterói,RJ
Faculdades Integradas Padrão (FIP GUANAMBI),FIP GUANAMBI,Av. Governador Waldir Pires - 215 Santa Catarina,Guanambi,BA
FACULDADES INTEGRADAS PAULISTA (FIP),FIP,Rua Ibipetuba - 42 Parque da Mooca,São Paulo,SP
FACULDADES INTEGRADAS POTENCIAL (FIP),FIP,Rua José Augusto Pedroso - 44 Vila São Francisco de Assis,Cotia,SP
FACULDADES INTEGRADAS QUALIS (FIQ),FIQ,Rua Dr. Sales - 116 Centro,Guarabira,PB
FACULDADES INTEGRADAS REGIONAIS DE AVARÉ (FIRA),FIRA,Praça Prefeito Romeu Bretas - 163 CENTRO,Avaré,SP
FACULDADES INTEGRADAS RIO BRANCO (FRB),FRB,Rua Capitão José Inácio do Rosário - 133 Lapa,São Paulo,SP
FACULDADES INTEGRADAS RIO BRANCO GRANJA VIANNA (FRB-GV),FRB-GV,Rodovia Raposo Tavares - 7200 Granja Viana,Cotia,SP
FACULDADES INTEGRADAS RUI BARBOSA (FIRB),FIRB,Rua Rodrigues Alves - 756 Centro,Andradina,SP
FACULDADES INTEGRADAS SANTA CRUZ DE CURITIBA (FARESC),FARESC,Rua Affife Mansur - 565 Novo Mundo,Curitiba,PR
FACULDADES INTEGRADAS SÃO JUDAS TADEU (SJT),SJT,Rua Dom Diogo de Souza - 100 Cristo Redentor,Porto Alegre,RS
FACULDADES INTEGRADAS SÃO PEDRO (FAESA),FAESA,Rua Alsemo Serrat - 199 Monte Belo,Vitória,ES
FACULDADES INTEGRADAS SILVA E SOUZA (FAU),FAU,ESTRADA DOS TRÊS RIOS - 385 JACAREPAGUÁ,Rio de Janeiro,RJ
FACULDADES INTEGRADAS SIMONSEN (FIS),FIS,Rua Ibitiuva - 151 Padre Miguel,Rio de Janeiro,RJ
FACULDADES INTEGRADAS SOARES DE OLIVEIRA (FISO),FISO,Avenida Vinte e Nove - 783 Centro,Barretos,SP
FACULDADES INTEGRADAS STELLA MARIS DE ANDRADINA (FISMA),FISMA,Rua Amazonas - 571 Stella Maris,Andradina,SP
FACULDADES INTEGRADAS TOLEDO DE TRÊS LAGOAS (TOLEDO),TOLEDO,Rua Urias Ribeiro - 2327 Jardim Progresso,Três Lagoas,MS
FACULDADES INTEGRADAS URUBUPUNGÁ (FIU),FIU,Avenida Coronel Jonas Alves de Mello - 1.660 Centro,Pereira Barreto,SP
FACULDADES INTEGRADAS VIANNA JÚNIOR (FIVJ),FIVJ,Avenida dos Andradas - 415 Centro,Juiz de Fora,MG
FACULDADE SISTEMA DE ENSINO GAÚCHO (FASEG),FASEG,Rua dos Andradas - 1001 Centro Histórico,Porto Alegre,RS
FACULDADES ITECNE DE CASCAVEL (ITECNE),ITECNE,Avenida Brasil - 8607 Coqueiral,Cascavel,PR
FACULDADES JOÃO PAULO II (FJP),FJP,Rua Tiradentes - 42 Centro,Passo Fundo,RS
FACULDADES JOÃO PAULO II - Campus Porto Alegre (FJP),FJP,Avenida Independência - 343 Independência,Porto Alegre,RS
FACULDADES JOÃO PAULO II - PELOTAS (FJP -PELOTAS),FJP -PELOTAS,Rua Marechal Floriano - 107 Centro,Pelotas,RS
FACULDADES JOÃO PAULO II - RIO GRANDE (FJP),FJP,Rua Marechal Deodoro - 628 Cidade Nova,Rio Grande,RS
FACULDADE SKEMA BUSINESS SCHOOL (SKEMA),SKEMA,Rua Bernardo Guimarães - 3071 Barro Preto,Belo Horizonte,MG
FACULDADES LONDRINA,-,Avenida Anália Franco - 750 Cervejaria,Londrina,PR
Faculdades Magsul (FAMAG),FAMAG,Avenida Presidente Vargas - 725 Centro,Ponta Porã,MS
Faculdades Metropolitanas de Cuiabá (FAMEC),FAMEC,Avenida Historiador Rubens de Mendonça - 6.020 Bosque da Saúde,Cuiabá,MT
FACULDADES NETWORK - CAMPUS SUMARÉ,-,R. Antonio Jorge Chebab - 774 Centro,Sumaré,SP
Faculdade SOCIESC,-,Rua Salvatina Feliciana dos Santos - 525 Itacorubi,Florianópolis,SC
Faculdade SOCIESC de Balneário Camboriú,-,Avenida Santa Catarina - 151 Bairro dos Estados,Balneário Camboriú,SC
Faculdade SOCIESC de Jaraguá do Sul (SOCIESC),SOCIESC,Rua Presidente Epitácio Pessoa - 676 Centro,Jaraguá do Sul,SC
FACULDADE SOGIPA DE EDUCAÇÃO FÍSICA,-,Avenida Benjamin Constant - 80 São João,Porto Alegre,RS
FACULDADE SOLIDÁRIA DE SOBRADINHO (FASOL),FASOL,Trecho SIA Trecho 8 - Lotes 70/80 Zona Industrial (Guará),Brasília,DF
FACULDADE SOLIDARIA DO OESTE PAULISTA (FASOL),FASOL,Rua Paulo Marcondes - 1447 Parque Residencial São Lucas,Presidente Prudente,SP
FACULDADES OSWALDO CRUZ (FOC),FOC,Rua Brigadeiro Galvão - 540 Barra Funda,São Paulo,SP
FACULDADES PEQUENO PRÍNCIPE (FPP),FPP,Avenida Iguaçu - 333 Rebouças,Curitiba,PR
FACULDADES PITÁGORAS UNIDADE GUARAPARI (FIPAG),FIPAG,Rodovia Jones dos Santos Neves - 1000 Lagoa Funda,Guarapari,ES
Faculdades Planalto Central (FPC),FPC,Trecho SIA Trecho 8 - S/N Zona Industrial (Guará),Brasília,DF
Faculdades Sulamérica Bahia,-,Rua Glaber Rocha - 66 Jardim Paraiso,Luís Eduardo Magalhães,BA
FACULDADE STBNB,-,Rua Padre Inglês - 243 Boa Vista,Recife,PE
Faculdade Stella Maris - FSM (FSM),FSM,Avenida Antônio Justa - 3.180 Meireles,Fortaleza,CE
FACULDADE SUCESSO (FACSU),FACSU,AVENIDA PREFEITO PEDRO EULÂMPIO DA SILVA - 3086 SÃO JOSÉ,São Bento,PB
FACULDADE SUDAMÉRICA (SUDAMÉRICA),SUDAMÉRICA,Rua Ofélia Resende - 101 Menezes,Cataguases,MG
FACULDADE SUDOESTE (FASU),FASU,Avenida Vivaldo Mendes Ferraz - 876 Recreio,Vitória da Conquista,BA
FACULDADE SUDOESTE PAULISTANO (FASUP),FASUP,Rua Santa Crescência - 443 Butantã,São Paulo,SP
FACULDADE SUDOESTE PAULISTA - TATUÍ - FSP (TATUÍ - FSP),TATUÍ - FSP,Rua Maneco Pereira - 619 Centro,Tatuí,SP
Faculdade Sulamérica Brasília,-,Avenida Gomes Rabelo - lote 09 Setor Tradicional (Planaltina),Brasília,DF
FACULDADE SUL-AMERICANA (FASAM),FASAM,Br 153 - S/N Jardim da Luz,Goiânia,GO
FACULDADE SUL DA AMÉRICA (SULDAMÉRICA),SULDAMÉRICA,Rua Iguaçu - s/n Vila Brasília,Aparecida de Goiânia,GO
FACULDADE SUL FLUMINENSE (FASF),FASF,Rua Alberto Rodrigues - 39 Jardim Amália I,Volta Redonda,RJ
Faculdade Sul Mineira (FASULMG),FASULMG,Rua Dr. Melo Viana - 75 Centro,São Lourenço,MG
Faculdade Sul Paulista de Itanhaém (FASUPI),FASUPI,Rua Paulo José de Moraes - S/N Sabaúna,Itanhaém,SP
"FACULDADES UNIDAS DE PESQUISA, CIÊNCIAS E SAÚDE LTDA (FAPEC)",FAPEC,Rua Dr. José Alfredo Guimarães - 317 São Luis,Jequié,BA
Faculdades Unificadas de Cataguases (FUC),FUC,Avenida Coronel Antônio Augusto de Souza - 442 Vila Tereza,Cataguases,MG
FACULDADES UNIFICADAS DE FOZ DO IGUAÇU (UNIFOZ),UNIFOZ,Rua Tiradentes - 460 Centro,Foz do Iguaçu,PR
Faculdades Unificadas de Iúna (FUI),FUI,Rua Professora Terpina Lacerda - s/n Quilombo,Iúna,ES
Faculdades Unificadas de Leopoldina (FUL),FUL,Avenida Getúlio Vargas - 635 Centro,Leopoldina,MG
Faculdade Superior de Ensino Programus (ISEPRO),ISEPRO,Rua Moraes - 310 Centro,Água Branca,PI
FACULDADE SUPERIOR DE RIBAS DO RIO PARDO (FASURP),FASURP,Avenida Aureliano Moura Brandão - 1.605 Jardim Vista Alegre,Ribas do Rio Pardo,MS
FACULDADE SUPREMO REDENTOR (FACSUR),FACSUR,RUA FLORIANO PEIXOTO - 604 CENTRO,Pinheiro,MA
Faculdades Vale do Piancó (FAVAP),FAVAP,Av. João Silvino da Fonseca - S/N Loteamento João Silvino da Fonseca,Itaporanga,PB
FACULDADE TAMANDARÉ (FAT),FAT,Rua T-27 - 1.374 Setor Bueno,Goiânia,GO
FACULDADE TECNOLOGIA EDUVALE - AVARÉ (FATEC EDUVALE),FATEC EDUVALE,Avenida Prefeito Misael Euphrasio Leal - 347 Jardim América,Avaré,SP
Faculdade Tecnológica de Limoeiro do Norte: Ladislau Pereira (FTLN),FTLN,,,
FACULDADE TECNOLÓGICA DENTAL CEEO (ESD-CEEO),ESD-CEEO,Rua da Independencia - 290 Centro,Igrejinha,RS
Faculdade Tecnológica de Pernambuco (FATEPE),FATEPE,Avenida Doutor José Augusto Moreira - 990 Casa Caiada,Olinda,PE
Faculdade Tecnológica Falcão (FTF),FTF,Rua 17 - S/N Setor Oeste,Goiânia,GO
FACULDADE TECNOLÓGICA INAP (FAT- INAP),FAT- INAP,Avenida Carandaí - 507 Funcionários,Belo Horizonte,MG
Faculdade Tecnológica Latino Americana (FATLA),FATLA,Avenida Alcides S. Severiano - 99 Sarandi,Porto Alegre,RS
FACULDADE TECNOLÓGICA SANTANNA (FACSANTANNA),FACSANTANNA,AVENIDA INDEPENDENCIA - 5656 AQUARIOS,Vinhedo,SP
FACULDADE TECSOMA (FATEC),FATEC,"Rodovia MG 188, KM 167 - s/n Fazendinha",Paracatu,MG
Faculdade Telos (FATELOS),FATELOS,Avenida Fernando Vilela - 2030 Oswaldo Rezende,Uberlândia,MG
FACULDADE TEOLÓGICA BATISTA ANA WOLLERMAN (FTBAW),FTBAW,Rua Dom João VI - 2850 Jardim Aydê,Dourados,MS
FACULDADE TEOLÓGICA BATISTA DE BRASÍLIA (FTBB),FTBB,Sgan 611 Módulo B - s/n Asa Norte,Brasília,DF
FACULDADE TEOLÓGICA BATISTA DE SÃO PAULO (FTBSP),FTBSP,Rua João Ramalho - 466 Perdizes,São Paulo,SP
FACULDADE TEOLÓGICA BATISTA EQUATORIAL (FATEBE),FATEBE,Br 316 Km 01 - 6241 Castanheira,Belém,PA
Faculdade Teológica Betânia (FATEBE),FATEBE,Avenida Iguaçu - 1700 Água Verde,Curitiba,PR
FACULDADE TEOLÓGICA DE CIÊNCIAS HUMANAS E SOCIAIS LOGOS (FAETEL),FAETEL,Rua Padre Adelino - 700 Belenzinho,São Paulo,SP
FACULDADE TEOLOGICA SÃO PAULO (FATESP),FATESP,Rua Cleto Barroso - 1027 Aparecida,Manacapuru,AM
FACULDADE TEOLÓGICA SUL AMERICANA (FTSA),FTSA,Rua Martinho Lutero - 277 Gleba Palhano,Londrina,PR
FACULDADE TERRA BRASILIS,-,ROD MT 422 ESCOLA AGRÍCOLA - 00 ZONA RURAL,Alto Boa Vista,MT
FACULDADE TERRA NORDESTE (FATENE),FATENE,Rua Coronel Correia - 1119 Parque Soledade,Caucaia,CE
Faculdade Thiago Ferreira (FAT),FAT,Avenida Conde de Áurea Gonzales - 245 Vila Áurea (Vicente de Carvalho),Guarujá,SP
FACULDADE TIRADENTES DE FEIRA DE SANTANA (FITS),FITS,Rua Doutor Sabino Silva - 32 Centro,Feira de Santana,BA
FACULDADE TIRADENTES DE JABOATÃO DOS GUARARAPES,-,Avenida General Barreto de Menezes - 738 Cajueiro Seco - Piedade,Jaboatão dos Guararapes,PE
FACULDADE TORRICELLI (FT),FT,Rua do Rosário - 313 Vila Camargos,Guarulhos,SP
FACULDADE TRÊS DE MAIO (SETREM),SETREM,Avenda Santa Rosa - 2.405 Centro,Três de Maio,RS
FACULDADE TRÊS MARIAS (FTM),FTM,Rua Vereador Alberto Falcão Barroca - 210 Miramar,João Pessoa,PB
FACULDADE TRÊS PONTAS (FATEP),FATEP,Praça D'Aparecida - 57 Centro,Três Pontas,MG
Faculdade Trilógica Keppe & Pacheco (Keppe & Pacheco),Keppe & Pacheco,Avenida Nossa Senhora Aparecida - 59 Centro,Cambuquira,MG
"Faculdade Uberlandense de Núcleos Integrados de Ensino, Serviço Social e Aprendizagem (FAESSA)",FAESSA,Rua Bocaiúva - 82 Morada da Colina,Uberlândia,MG
FACULDADE UBS (FACULDADE UBS),FACULDADE UBS,Avenida Conde de Frontin - 1154 Chácara Califórnia,São Paulo,SP
Faculdade UNA de Betim (UNA),UNA,Avenida Governador Valadares - 640 Centro,Betim,MG
FACULDADE UNA DE CATALÃO (UNA),UNA,Rua Ademar Ferrugem - 840 Santo Antônio,Catalão,GO
FACULDADE UNA DE CONTAGEM (FUNAC),FUNAC,Avenida João César de Oliveira - 5775 Beatriz,Contagem,MG
Faculdade Una de Divinópolis (Una Divinopolis),Una Divinopolis,Rua Coronel João Notini - 151 Centro,Divinópolis,MG
Faculdade Una de Jataí (Una),Una,Avenida José de Carvalho - s/n Setor Epaminondas II,Jataí,GO
FACULDADE UNA DE NOVA SERRANA (UNA),UNA,BR 262 - Km 448 - s/n Anexo ao Distrito Industrial José Silva de Almeida,Nova Serrana,MG
Faculdade Una de Pouso Alegre (Una PousoAlegre),Una PousoAlegre,Rua João Basílio - 420 Centro,Pouso Alegre,MG
Faculdade Una de Sete Lagoas (Unaset),Unaset,Avenida Secretário Divino Padrão - 1.411 Santo Antônio,Sete Lagoas,MG
FACULDADE UNA DE UBERLÂNDIA (UNA),UNA,Alameda Paulina Margonari - 59 Jardim Karaíba,Uberlândia,MG
FACULDADE UNIÃO ARARUAMA DE ENSINO S/S Ltda. (FAC-UNILAGOS),FAC-UNILAGOS,Rua Marechal Castelo Branco - 333 Rio do Limão,Araruama,RJ
FACULDADE UNIÃO BANDEIRANTE,-,Rua Luiz Fagundes - 1.680 Picadas do Sul,São José,SC
FACULDADE UNIÃO CULTURAL DO ESTADO DE SÃO PAULO (UCESP),UCESP,Avenida da Saudade - 757 Vila Estádio,Araçatuba,SP
FACULDADE UNIÃO DE CAMPO MOURÃO,-,Via Marginal Rosalina Maria dos Santos - 927 Área Urbanizada I,Campo Mourão,PR
FACULDADE UNIÃO DE GOYAZES (FUG),FUG,Rodovia Go-060 Km 19 - 3.184 Setor Laguna Parque,Trindade,GO
FACULDADE UNIBF,-,Rua Olavo Bilac - 78 Centro,Paraíso do Norte,PR
Faculdade Única de Contagem (FUNIC),FUNIC,Rua Professor Sigefredo Marques - 341 Estância do Hibisco,Contagem,MG
Faculdade Única de Ipatinga (FUNIP),FUNIP,Rua Salermo - 299 Bethânia,Ipatinga,MG
FACULDADE ÚNICA DE TIMÓTEO (FUNIT),FUNIT,Avenida Ari Barroso - 765 Serenata,Timóteo,MG
FACULDADE UNIDA DE CAMPINAS (FACUNICAMPS),FACUNICAMPS,Rua 210 - 386 Setor Coimbra,Goiânia,GO
Faculdade Unida de Campinas Goiânia - FACUNICAMPS GOIÂNIA (FACUNICAMPS),FACUNICAMPS,"Rua 234, 371 - Setor Coimbra",Goiânia,GO
FACULDADE UNIDA DE VITÓRIA (FACULDADE UNIDA),FACULDADE UNIDA,Rua Engenheiro Fábio Ruschi - 161 Bento Ferreira,Vitória,ES
FACULDADE UNIDAS DE TATUI (FDT),FDT,Rua Oracy Gomes - 665 Centro,Tatuí,SP
FACULDADE UNIFAMETRO CASCAVEL,-,AC Cascavel - 2667 Centro,Cascavel,CE
FACULDADE UNIFAMETRO MARACANAÚ,-,Rodovia Senador Almir Pinto - CE 065 - 8885 Jaçanaú,Maracanaú,CE
FACULDADE UNIFICADA DO ESTADO DE SÃO PAULO (FAUESP),FAUESP,Rua Luís Lacava - 239 Vila Bocaina,Mauá,SP
FACULDADE UNILAGOS (UNILAGOS),UNILAGOS,Rua Saldanha Marinho - 85 Centro,Mangueirinha,PR
FACULDADE UNIMED,-,Avenida Flávio dos Santos - 355 Floresta,Belo Horizonte,MG
FACULDADE UNIME DE CIÊNCIAS EXATAS E TECNOLÓGICAS (FCT),FCT,Avenida Luiz Tarquínio Pontes - 600 Centro,Lauro de Freitas,BA
FACULDADE UNIME DE CIÊNCIAS JURÍDICAS (FCJ),FCJ,Avenida Avenida Luiz Tarquínio Pontes - 600 Centro,Lauro de Freitas,BA
FACULDADE UNIME DE CIÊNCIAS SOCIAIS (FCS),FCS,Avenida Avenida Luiz Tarquínio Pontes - 600 Centro,Lauro de Freitas,BA
FACULDADE UNIME DE EDUCAÇÃO E COMUNICAÇÃO (FEC),FEC,Avenida Luiz Tarquinio Pontes - 600 Centro,Lauro de Freitas,BA
FACULDADE UNINABUCO BELÉM (NABUCO BELÉM),NABUCO BELÉM,Rodovia Augusto Montenegro - 650 Tenoné,Belém,PA
FACULDADE UNINABUCO JOÃO PESSOA,-,Rua Agente Fiscal Amadeu de Castro - 313 Aeroclube,João Pessoa,PB
FACULDADE UNINABUCO MACEIÓ,-,Rua Doutor Cláudio Lívio - 83 Farol,Maceió,AL
FACULDADE UNINABUCO MANAUS (NABUCO MANAUS),NABUCO MANAUS,Rua Tapajós - 200 Centro,Manaus,AM
FACULDADE UNINABUCO NATAL,-,Rua Marcílio Furtado - 2422 Lagoa Nova,Natal,RN
FACULDADE UNINABUCO SALVADOR (NABUCO SALVADOR),NABUCO SALVADOR,Avenida Sete de Setembro - 1105 Dois de Julho,Salvador,BA
FACULDADE UNINABUCO SÃO LOURENÇO DA MATA,-,Av. Almirante Tamandaré - 100 Centro,São Lourenço da Mata,PE
FACULDADE UNINASSAU ALIANÇA,-,Rua São Pedro - 965 Centro,Teresina,PI
Faculdade Uninassau Ananindeua (NASSAU ANANINDEUA),NASSAU ANANINDEUA,Travessa We-31 - 55 Cidade Nova,Ananindeua,PA
FACULDADE UNINASSAU ARACAJU,-,Rua de Riachuelo - 1071 São José,Aracaju,SE
Faculdade Uninassau Arapiraca,-,Rua Dom Felício Vasconcelos - 320 Centro,Arapiraca,AL
FACULDADE UNINASSAU BELÉM,-,Travessa Quintino Bocaiúva - 1808 Nazaré,Belém,PA
FACULDADE UNINASSAU CABO,-,Avenida Historiador Pereira da Costa - 473 Centro,Cabo de Santo Agostinho,PE
FACULDADE UNINASSAU CARUARU,-,Entroncamento da Rodovia BR-232 com a BR 104 - 1215 Agamenom Magalhães,Caruaru,PE
FACULDADE UNINASSAU FEIRA DE SANTANA,-,Avenida Senhor dos Passos - 242 Centro,Feira de Santana,BA
FACULDADE UNINASSAU FORTALEZA,-,Avenida Visconde do Rio Branco - 2078 Joaquim Távora,Fortaleza,CE
Faculdade Uninassau Fortaleza Savanah (Nassau Savanah),Nassau Savanah,Rua Antônio Gentil Gomes - 408 Cambeba,Fortaleza,CE
Faculdade Uninassau Garanhuns (Nassau Garanhuns),Nassau Garanhuns,Praça da Bandeira - 53 São José,Garanhuns,PE
FACULDADE UNINASSAU JABOATÃO DOS GUARARAPES (UNINASSAU),UNINASSAU,Rua 101 - 15 Guararapes,Jaboatão dos Guararapes,PE
FACULDADE UNINASSAU JOÃO PESSOA,-,Avenida Presidente Epitácio Pessoa - 67 Estados,João Pessoa,PB
FACULDADE UNINASSAU JUAZEIRO DO NORTE,-,Rua Nossa Senhora do Carmo - s/n Franciscano,Juazeiro do Norte,CE
FACULDADE UNINASSAU LAURO DE FREITAS,-,"Estrada do Coco Km 4,5 - S/N Centro",Lauro de Freitas,BA
FACULDADE UNINASSAU MANAUS,-,Avenida Djalma Batista - 377 Nossa Senhora das Graças (Chapada),Manaus,AM
FACULDADE UNINASSAU MARACANAÚ,-,Rua Senador Petronio Portela - 125 Pajuçara,Maracanaú,CE
FACULDADE UNINASSAU MOSSORÓ,-,Rua Marechal Floriano - 39 Paredões,Mossoró,RN
FACULDADE UNINASSAU NATAL,-,Av Avenida Engenheiro Roberto Freire - 1.514 Capim Macio,Natal,RN
FACULDADE UNINASSAU OLINDA,-,Avenida Presidente Getúlio Vargas - 1154 Bairro Novo,Olinda,PE
Faculdade Uninassau Olinda - Nassau Olinda,-,Rua Eduardo de Moraes - s/n Casa Caiada,Olinda,PE
FACULDADE UNINASSAU PARNAÍBA,-,"BR 343 - Km 7,5 Floriópolis",Parnaíba,PI
FACULDADE UNINASSAU PARNAMIRIM,-,Rua Pedro Bezerra Filho - 35 Santos Reis,Parnamirim,RN
Faculdade Uninassau Patos (NASSAU PATOS),NASSAU PATOS,Rua Vandy Alves - s/n São Sebastião,Patos,PB
FACULDADE UNINASSAU PETROLINA,-,Avenida Coronel Clementino Coelho - 714 Atrás da Banca,Petrolina,PE
FACULDADE UNINASSAU SÃO LUÍS,-,Rua Zoé Cerveira - 120 Alemanha,São Luís,MA
FACULDADE UNINASSAU SOBRAL,-,Pedro Aguiar Carneiro - 365 Domingos Olímpio,Sobral,CE
FACULDADE UNINASSAU TERESINA,-,Avenida Joquei Clube - 710 Joquei Clube,Teresina,PI
FACULDADE UNINASSAU VITÓRIA DA CONQUISTA,-,Avenida Otávio Santos - 132 Recreio,Vitória da Conquista,BA
Faculdade - Uninorte Altamira,-,Avenida Tancredo Neves - 3414 Jardim Independente I,Altamira,PA
Faculdade - Uninorte Barcarena,-,Rua Eduardo Angelin - s/n vila dos cabanos,Barcarena,PA
FACULDADE UNINORTE TUCURUÍ,-,Rodovia BR-422 - 422 Santa Mônica,Tucuruí,PA
Faculdade UNIRB - ARACAJU,-,Rua Joventina Alves - 387 Salgado Filho,Aracaju,SE
Faculdade UNIRB - ARAPIRACA,-,RODOVIA AL - 220 - S/N ARNON DE MELLO,Arapiraca,AL
Faculdade Unirb - Barreiras,-,Avenida Anhylon Macedo - 1.029 Morada Nobre,Barreiras,BA
FACULDADE UNIRB - CAMAÇARI (FACULDADE UNIRB),FACULDADE UNIRB,Avenida Jorge Amado - Sn Limoeiro,Camaçari,BA
Faculdade Unirb - Ceará,-,Avenida Domingos Olímpio - 1550 FARIAS BRITO,Fortaleza,CE
Faculdade Unirb - Feira de Santana,-,Avenida Deputado Luís Eduardo Magalhães - Sn Subaé,Feira de Santana,BA
FACULDADE UNIRB - JUAZEIRO (FACULDADE UNIRB),FACULDADE UNIRB,Praça Barão do Rio Branco - S/N Centro,Juazeiro,BA
FACULDADE UNIRB - MACEIO (Faculdade Unirb),Faculdade Unirb,Avenida Menino Marcelo - 7600 Serraria,Maceió,AL
Faculdade Unirb - Mossoró,-,Avenida Francisco Mota - 3310 Presidente Costa e Silva,Mossoró,RN
Faculdade UNIRB - NATAL,-,Avenida Senador Salgado Filho - 2810 Lagoa Nova,Natal,RN
Faculdade Unirb - Parnaíba,-,Loteamento Morada dos Ventos - S/Nº Sabiazal,Parnaíba,PI
