FACULDADE DE TECNOLOGIA FAESA - VILA VELHA (CETFAESA),CETFAESA,AVENIDA CHAMPAGNAT - 925 CENTRO,Vila Velha,ES
FACULDADE DE TECNOLOGIA FAMA (FAMA),FAMA,Avenida Engº. Abdias de Carvalho - 794 Bongi,Recife,PE
Faculdade de Tecnologia - Fatec de Ribeirão Preto,-,Avenida Pio XII - 1255 Vila Virgínia,Ribeirão Preto,SP
FACULDADE DE TECNOLOGIA FATEP (FATEP),FATEP,Avenida 25 - 148 Vila Santo Antonio,Rio Claro,SP
FACULDADE DE TECNOLOGIA FINACI (FINACI),FINACI,Praça Pedro Lessa - 41 Centro,São Paulo,SP
FACULDADE DE TECNOLOGIA FRANCISCO MORATO (FFRAMO),FFRAMO,Rua dos Cravos - 560 Vila Espanhola,Francisco Morato,SP
FACULDADE DE TECNOLOGIA FTEC (FTEC Bento Gonçalves),FTEC Bento Gonçalves,Rua Osvaldo Aranha - 419 Centro,Bento Gonçalves,RS
FACULDADE DE TECNOLOGIA FTEC (FTEC Novo Hamburgo),FTEC Novo Hamburgo,Rua Silveira Martins - 780 Centro,Novo Hamburgo,RS
FACULDADE DE TECNOLOGIA FTEC (FTEC Porto Alegre),FTEC Porto Alegre,Rua Comendador Manoel Pereira - 249 Centro Histórico,Porto Alegre,RS
FACULDADE DE TECNOLOGIA FUNDAÇÃO UNIVERSITÁRIA DE CARDIOLOGIA,-,Av. Princesa Isabel - 370 Santana,Porto Alegre,RS
FACULDADE DE TECNOLOGIA FUTURO (Fatec Futuro),Fatec Futuro,Rua 24 de Maio - 1129 Rebouças,Curitiba,PR
FACULDADE DE TECNOLOGIA GAP (GAP),GAP,Rua 18 de Setembro - 78 Jundiaí,Anápolis,GO
FACULDADE DE TECNOLOGIA IAPEC (IAPEC),IAPEC,Avenida Tiradentes - 858 Jardim Shangri-La A,Londrina,PR
FACULDADE DE TECNOLOGIA IBRATE (FAITEC),FAITEC,RUA VOLUNTÁRIOS DA PÁTRIA - 215 CENTRO,Curitiba,PR
FACULDADE DE TECNOLOGIA IBRATEC (IBRATEC),IBRATEC,Avenida Marechal Mascarenhas de Morais - 4989-A Imbiribeira,Recife,PE
FACULDADE DE TECNOLOGIA IBTA - SÃO JOSÉ DOS CAMPOS (IBTA),IBTA,Rua Francisco Paes - 84 Centro,São José dos Campos,SP
Faculdade de Tecnologia Ícone (FACTI),FACTI,QNE 14 - 18 Taguatinga,Brasília,DF
FACULDADE DE TECNOLOGIA INESUL DO PARANÁ (FIPAR),FIPAR,Avenida Sete de Setembro - 3457 Centro,Curitiba,PR
FACULDADE DE TECNOLOGIA INFORMÁTICA (FATI),FATI,Rua D. Leopoldina - 912 Aldeota,Fortaleza,CE
FACULDADE DE TECNOLOGIA INSAEOS (INSAEOS),INSAEOS,Rua Mato Grosso - 408 São Cristóvão,Cascavel,PR
FACULDADE DE TECNOLOGIA INTERAMÉRICA (INTERAMERICA),INTERAMERICA,Rua Libero Badaró - 487 Centro,São Paulo,SP
FACULDADE DE TECNOLOGIA IPANEMA,-,Rua Mario Campestrini - 100 Parque Campolim,Sorocaba,SP
Faculdade de Tecnologia IPENO (FACTIPENO),FACTIPENO,Rua Bocaiúva - 2468 Centro,Florianópolis,SC
FACULDADE DE TECNOLOGIA IPEP DE CAMPINAS (FATEC CAMPINAS),FATEC CAMPINAS,Rua José de Alencar - 470 Centro,Campinas,SP
FACULDADE DE TECNOLOGIA IPEP DE SÃO PAULO (FATEC SP),FATEC SP,Rua Pirapitingui - 186 Liberdade,São Paulo,SP
FACULDADE DE TECNOLOGIA IPPEO (IPPEO),IPPEO,Rua Jose Loureiro - 347 Centro,Curitiba,PR
FACULDADE DE TECNOLOGIA IPUC (FATIPUC),FATIPUC,Avenida Guilherme Schell - 5000 Centro,Canoas,RS
FACULDADE DE TECNOLOGIA JARDIM (FATEJ),FATEJ,Rua Almirante Protógenes - 68 Bairro Jardim,Santo André,SP
Faculdade de Tecnologia Jorge Caram Sabbag (FATEC Bebedouro),FATEC Bebedouro,Rua Doutor Oscar Werneck - 1286 Centro,Bebedouro,SP
FACULDADE DE TECNOLOGIA LA SALLE - ESTRELA (FACSALLE),FACSALLE,Rua Tiradentes - 401 Centro,Estrela,RS
FACULDADE DE TECNOLOGIA LOURENÇO FILHO (FATEC FLF),FATEC FLF,Rua General Osório de Paiva - 395 Parangaba,Fortaleza,CE
FACULDADE DE TECNOLOGIA LUIZ ADELAR SCHEUER (FATEC- JF),FATEC- JF,AVENIDA RIO BRANCO - 1219 CENTRO,Juiz de Fora,MG
FACULDADE DE TECNOLOGIA MÁRIO DE ANDRADE (FTMA),FTMA,Rua Clélia - 965 Vila Romana,São Paulo,SP
FACULDADE DE TECNOLOGIA NILO DE STÉFANI - JABOTICABAL (FATEC JBL),FATEC JBL,"VIA DE ACESSO PROF. PAULO DONATO CASTELLANE, - S/Nº VILA INDUSTRIAL",Jaboticabal,SP
FACULDADE DE TECNOLOGIA NOVA PALHOÇA (FATENP),FATENP,Avenida Vidal Procópio Lohn - 1081 Nova Palhoça,Palhoça,SC
FACULDADE DE TECNOLOGIA OSWALDO CRUZ (FATEC OSWALDO CRUZ),FATEC OSWALDO CRUZ,Rua Brigadeiro Galvão Prédio - 540 Barra Funda,São Paulo,SP
FACULDADE DE TECNOLOGIA PAULISTA,-,Avenida Santo Inácio - 1.089 Jardim Floresta,Lupércio,SP
FACULDADE DE TECNOLOGIA PEDRO ROGÉRIO GARCIA (FATTEP),FATTEP,"Rodovia Sct 283, Km 17 - 8100 Vila Fragosos",Concórdia,SC
FACULDADE DE TECNOLOGIA PENTÁGONO (FATEP),FATEP,Rua Coronel Fernando Prestes - 326 Centro,Santo André,SP
Faculdade de Tecnologia Pitágotas - Unidade Londrina,-,Avenida Celso Garcia Cid - 1523 Jardim Siam,Londrina,PR
FACULDADE DE TECNOLOGIA PORTO DAS MONÇÕES (FAMO),FAMO,RUA CONSTANTINO GUARINI - 150 Centro,Porto Feliz,SP
FACULDADE DE TECNOLOGIA PORTO SUL (FAPS),FAPS,Avenida Presidente Kennedy - 4000 AVIACAO,Praia Grande,SP
FACULDADE DE TECNOLOGIA PROFESSOR ANTÔNIO SEABRA (FATEC LINS),FATEC LINS,Estrada Mário Covas Júnior - S/N Zona Rural,Lins,SP
FACULDADE DE TECNOLOGIA RUBENS LARA (FATEC-BS),FATEC-BS,Avenida Bartolomeu de Gusmão 110 Fatec - Faculdade de Tecnólogia da Baixada Santista - 110 Aparecida,Santos,SP
FACULDADE DE TECNOLOGIA SAINT PASTOUS (FSP),FSP,Rua São Luís - 132 Santana,Porto Alegre,RS
FACULDADE DE TECNOLOGIA SAINT PAUL,-,Rua Pamplona - 1616 Jardim Paulista,São Paulo,SP
Faculdade de Tecnologia Santo André (FATEC-SA),FATEC-SA,Rua Prefeito Justino Paixão - 150 Centro,Santo André,SP
FACULDADE DE TECNOLOGIA SÃO MATEUS (FATESM),FATESM,Rua Alexandre Guimarães - 1.927 Areal,Porto Velho,RO
Faculdade de Tecnologia Sebrae (FATEC SEBRAE),FATEC SEBRAE,Alameda Nothmann - 598 Campos Elíseos,São Paulo,SP
FACULDADE DE TECNOLOGIA SENAC AMAZONAS,-,RUA 10 DE JULHO - 11 Centro,Manaus,AM
Faculdade de Tecnologia Senac Curitiba,-,Rua André de Barros - 750 Centro,Curitiba,PR
Faculdade de Tecnologia Senac Curitiba Portão,-,Rua Calixto Razolini - 215 Portão,Curitiba,PR
FACULDADE DE TECNOLOGIA SENAC DF (FAC SENAC DF),FAC SENAC DF,Quadra SEPS 703/903 - s/n Asa Sul,Brasília,DF
Faculdade de Tecnologia Senac Maringá,-,Avenida Colombo - 6225 Jardim Universitário,Maringá,PR
FACULDADE DE TECNOLOGIA SENAC MINAS - UNIDADE BARBACENA,-,Rua Mucurí - 201 Caiçaras,Barbacena,MG
FACULDADE DE TECNOLOGIA SENAC MINAS - UNIDADE BELO HORIZONTE (FTS),FTS,Rua Tupinambás - 1038 Centro,Belo Horizonte,MG
FACULDADE DE TECNOLOGIA SENAC PELOTAS (FATEC SENAC PELOTAS),FATEC SENAC PELOTAS,Rua Gonçalves Chaves - 602 Centro,Pelotas,RS
FACULDADE DE TECNOLOGIA SENAC RIO (FATEC),FATEC,Rua Santa Luzia - 735 Centro,Rio de Janeiro,RJ
FACULDADE DE TECNOLOGIA SENAI ANCHIETA,-,Rua Gandavo - 550 Vila Mariana,São Paulo,SP
FACULDADE DE TECNOLOGIA SENAI ANTOINE SKAF (SENAI),SENAI,Rua Anhaia - 1321 Bom Retiro,São Paulo,SP
FACULDADE DE TECNOLOGIA SENAI ANTÔNIO ADOLPHO LOBBE,-,Rua Cândido Padim - 25 Vila Prado,São Carlos,SP
FACULDADE DE TECNOLOGIA SENAI BELO HORIZONTE (FATEC SENAI BH),FATEC SENAI BH,Avenida Afonso Pena - 1500 Centro,Belo Horizonte,MG
FACULDADE DE TECNOLOGIA SENAI BLUMENAU (CET BLUMENAU),CET BLUMENAU,Rua São Paulo - 1147 Victor Konder,Blumenau,SC
FACULDADE DE TECNOLOGIA SENAI BRUSQUE (SENAI/SC BRUSQUE),SENAI/SC BRUSQUE,Avenida 1º de Maio - 670 Centro,Brusque,SC
FACULDADE DE TECNOLOGIA SENAI CAMPO GRANDE,-,Avenida Afonso Pena - 1114 Amambaí,Campo Grande,MS
FACULDADE DE TECNOLOGIA SENAI CASCAVEL,-,Rua Heitor Stockler de França - 161 Maria Luiza,Cascavel,PR
FACULDADE DE TECNOLOGIA SENAI CETIND,-,Avenida Luiz Tarquínio Pontes - 938 Aracuí,Lauro de Freitas,BA
FACULDADE DE TECNOLOGIA SENAI CHAPECÓ (SENAI),SENAI,Rua Frei Bruno - 201 E Parque das Palmeiras,Chapecó,SC
FACULDADE DE TECNOLOGIA SENAI CIC,-,RUA SENADOR ACCIOLY FILHO - 298 C.I.C.,Curitiba,PR
FACULDADE DE TECNOLOGIA SENAI CONCÓRDIA (CET CONCÓRDIA),CET CONCÓRDIA,Rua 29 de Julho - 1786 Vila Itaíba,Concórdia,SC
FACULDADE DE TECNOLOGIA SENAI CONDE JOSÉ VICENTE DE AZEVEDO,-,Rua Moreira de Godói - 226 Ipiranga,São Paulo,SP
FACULDADE DE TECNOLOGIA SENAI CURITIBA,-,Avenida Comendador Franco - 1341 Jardim Botânico,Curitiba,PR
FACULDADE DE TECNOLOGIA SENAI DE DESENVOLVIMENTO GERENCIAL (FATESG),FATESG,Rua 227-A - 95 Setor Leste Universitário,Goiânia,GO
Faculdade de Tecnologia SENAI Dourados (FATEC Dourados),FATEC Dourados,Rua 20 de Dezembro - 2445 Jardim Rasslem,Dourados,MS
FACULDADE DE TECNOLOGIA SENAI FELIX GUISARD,-,Avenida Independência - 846 Independência,Taubaté,SP
FACULDADE DE TECNOLOGIA SENAI FLORIANÓPOLIS (SENAI -SC - CTAI),SENAI -SC - CTAI,Rodovia Sc 401 - 3730 Saco Grande,Florianópolis,SC
FACULDADE DE TECNOLOGIA SENAI GASPAR RICARDO JUNIOR,-,Praça Roberto Mange - S/N Jardim Santa Rosália,Sorocaba,SP
FACULDADE DE TECNOLOGIA SENAI ÍTALO BOLOGNA (FATECIB),FATECIB,Armogaste J. Silveira - 612 Setor Centro Oeste,Goiânia,GO
FACULDADE DE TECNOLOGIA SENAI JARAGUÁ DO SUL (FATEC),FATEC,Rua Isidoro Pedri - 263 Rio Molha,Jaraguá do Sul,SC
FACULDADE DE TECNOLOGIA SENAI JOINVILLE (SENAI DE JOINVILLE),SENAI DE JOINVILLE,Rua Arno Waldemar Dohler - 957 Santo Antônio,Joinville,SC
FACULDADE DE TECNOLOGIA SENAI LONDRINA,-,Rua Belém - 844 Centro,Londrina,PR
FACULDADE DE TECNOLOGIA SENAI LUZERNA (SENAI LUZERNA),SENAI LUZERNA,Rua Frei João - 400 Centro,Luzerna,SC
FACULDADE DE TECNOLOGIA SENAI MARIANO FERRAZ,-,Rua Jaguaré Mirim - 71 Vila Leopoldina,São Paulo,SP
FACULDADE DE TECNOLOGIA SENAI MARINGÁ,-,Rua Vereador Nelson Abrão - 80 Zona 05,Maringá,PR
Faculdade de Tecnologia Senai Mario Amato (SENAI),SENAI,Avenida José Odorizzi - 1555 Assunção,São Bernardo do Campo,SP
FACULDADE DE TECNOLOGIA SENAI MATO GROSSO (FATEC SENAI MT),FATEC SENAI MT,Avenida XV de Novembro - 303 Porto,Cuiabá,MT
FACULDADE DE TECNOLOGIA SENAI NADIR DIAS DE FIGUEIREDO,-,Rua Ari Barroso - 305 Presidente Altino,Osasco,SP
FACULDADE DE TECNOLOGIA SENAI PAULO DE TARSO (FATEC SENAI PT),FATEC SENAI PT,Rua Humaitá - 1275 Padre Eustáquio,Belo Horizonte,MG
FACULDADE DE TECNOLOGIA SENAI PERNAMBUCO,-,Avenida Norte Miguel Arraes de Alencar - 539 Santo Amaro,Recife,PE
FACULDADE DE TECNOLOGIA SENAI PORTO ALEGRE (FATEC SENAI),FATEC SENAI,Avenida Assis Brasil - 8450 Sarandi,Porto Alegre,RS
FACULDADE DE TECNOLOGIA SENAI RIO DO SUL (SENAI RIO DO SUL),SENAI RIO DO SUL,Estrada da Madeira - 3000 Barragem,Rio do Sul,SC
FACULDADE DE TECNOLOGIA SENAI ROBERTO MANGE,-,Rua Pastor Cícero Canuto de Lima - 71 Parque Itália,Campinas,SP
FACULDADE DE TECNOLOGIA SENAI ROBERTO MANGE (FATEC SENAI RM),FATEC SENAI RM,Avenida Engenheiro Roberto Mange - 239 Jundiaí,Anápolis,GO
Faculdade de Tecnologia SENAI Roberto Simonsen,-,Rua Monsenhor Andrade - 298 Brás,São Paulo,SP
FACULDADE DE TECNOLOGIA SENAI SÃO JOSÉ (SENAISC),SENAISC,Br 101 Km211 - 7235 Aréa Industrial,São José,SC
Faculdade de Tecnologia SENAI Suiço-Brasileira Paulo Ernesto Tolle,-,Rua Bento Branco de Andrade Filho - 379 Jardim Dom Bosco,São Paulo,SP
FACULDADE DE TECNOLOGIA SENAI TELÊMACO BORBA,-,AV. PRESIDENTE KENNEDY - 66 CENTRO,Telêmaco Borba,PR
Faculdade de Tecnologia Senai Theobaldo de Nigris (SP SENAI),SP SENAI,Rua Bresser - 2315 Mooca,São Paulo,SP
FACULDADE DE TECNOLOGIA SENAI TOLEDO,-,Rua Júlio de Castilho - 3465 Vila Industrial,Toledo,PR
FACULDADE DE TECNOLOGIA TERMOMECÂNICA (FTT),FTT,Estrada dos Alvarengas - 4001 Alvarenga,São Bernardo do Campo,SP
FACULDADE DE TECNOLOGIA TUPY DE SÃO BENTO DO SUL (FTT-SBS),FTT-SBS,Rua Doutor Hans Dieter Schmidt - 879 Centenário,São Bento do Sul,SC
FACULDADE DE TECNOLOGIA ZONA LESTE (FATEC-ZL),FATEC-ZL,Rua Sonho Gaúcho - 641 Cidade AE Carvalho,São Paulo,SP
FACULDADE DE TECNOOLOGIA AEROTD (FATECAEROTD),FATECAEROTD,Rua Madalena Barbie - 46 Centro,Florianópolis,SC
FACULDADE DE TECONOLOGIA DA ZONA SUL (FATEC ZONASUL),FATEC ZONASUL,Rua Frederico Grotte - 322 Jardim Vergueiro,São Paulo,SP
FACULDADE DE TELÊMACO BORBA (FATEB),FATEB,Avenida Marechal Floriano Peixoto - 1181 Alto das Oliveiras,Telêmaco Borba,PR
FACULDADE DE TEODORO SAMPAIO (FTS),FTS,Rua Pará - 506 Estação,Teodoro Sampaio,SP
FACULDADE DE TEOLOGIA CARDEAL EUGÊNIO SALES (FCS),FCS,Praça Dom José Delgado - s/n Paraíba,Caicó,RN
FACULDADE DE TEOLOGIA DA ARQUIDIOCESE DE BRASÍLIA (FATEO),FATEO,"SGAS Quadra 914, Conjunto B - Asa Sul",Brasília,DF
FACULDADE DE TEOLOGIA DE HOKEMÃH (FATEH),FATEH,Rua 2 Quadra 2 - 6 Alto São Francisco,Vitória do Mearim,MA
FACULDADE DE TEOLOGIA DE SÃO PAULO DA IGREJA PRESBITERIANA INDEPENDENTE DO BRASIL,-,Rua Genebra - 180 Bela Vista,São Paulo,SP
FACULDADE DE TEOLOGIA E CIÊNCIAS (FATEC),FATEC,Rua José Sanches Peres - 3040 São João,Votuporanga,SP
FACULDADE DE TEOLOGIA E CIÊNCIAS HUMANAS (FATECH),FATECH,Avenida Professora Cora de Carvalho - 1648 Centro,Macapá,AP
FACULDADE DE TEOLOGIA E CIÊNCIAS HUMANAS (ITEPAFACULDADES),ITEPAFACULDADES,Rua Coronel Chicuta - 436 Centro,Passo Fundo,RS
FACULDADE DE TEOLOGIA EVANGÉLICA EM CURITIBA - FATEV (FATEV),FATEV,Rua Francisco Caron - 630 Pilarzinho,Curitiba,PR
"FACULDADE DE TEOLOGIA, FILOSOFIA E CIÊNCIAS HUMANAS GAMALIEL (FATEFIG)",FATEFIG,Rua Gamaliel - 11 Jardim Marilucy,Tucuruí,PA
Faculdade de Teologia Fortaleza - FATEFOR (FATEFOR),FATEFOR,Rua General Sampaio - 1525 Centro,Fortaleza,CE
FACULDADE DE TEOLOGIA INTEGRADA (FATIN),FATIN,"BR 101 Km 42,5 - s/n Centro",Igarassu,PE
FACULDADE DE TEOLOGIA UMBANDISTA (F.T.U.),F.T.U.,Avenida Santa Catarina - 400/414 Vila Alexandria,São Paulo,SP
FACULDADE DE TIETÊ,-,Rua Santa Terezinha - 425 Belvedere,Tietê,SP
FACULDADE DE TUPÃ,-,Rua Mandaguaris - 274 Centro,Tupã,SP
FACULDADE DE TUPI PAULISTA (-),-,Rua Arcebispo Lemieux - 250 Centro,Tupi Paulista,SP
FACULDADE DE TURISMO DE CARATINGA (FATUR),FATUR,Rua João Pinheiro - 113 Centro,Caratinga,MG
FACULDADE DE UMUARAMA,-,Rua Farroupilha - s/n Jardim Tamoyo,Umuarama,PR
FACULDADE DE VARGEM GRANDE PAULISTA,-,Estrada Planalto - 174 São João,Vargem Grande Paulista,SP
FACULDADE DE VIÇOSA (FDV),FDV,Rua Gomes Barbosa - 870 Centro,Viçosa,MG
FACULDADE DE VINHEDO (FV),FV,Av. João Pescarini - 568 Jardim Trevisan II,Vinhedo,SP
FACULDADE DE VITÓRIA,-,Rua Sagrado Coração de Maria - 315 Praia do Canto,Vitória,ES
FACULDADE DEXTER (DEXTER),DEXTER,Rua Borges Machado - 640 Pindorama,Parnaíba,PI
FACULDADE DIADEMA (FAD),FAD,Avenida Alda - 831 Parque 7 de Setembro,Diadema,SP
FACULDADE DINÂMICA DO VALE DO PIRANGA (FADIP),FADIP,Rua G - 205 Paraíso,Ponte Nova,MG
FACULDADE DÍNAMO EDUCAÇÃO (DÍNAMO),DÍNAMO,Avenida Governador José Malcher - 1255 Nazaré,Belém,PA
FACULDADE DIOCESANA SÃO JOSÉ (FADISI),FADISI,Estrada São do Francisco - 1576 Vitória,Rio Branco,AC
FACULDADE DIVINÓPOLIS (FACED),FACED,Praça do Mercado - 191 Centro,Divinópolis,MG
FACULDADE DO ACRE (FAC),FAC,Br 364 Km 02 - 200 Jardim Europa II,Rio Branco,AC
FACULDADE DO AMAZONAS (IAES),IAES,Rua Pará - 885 Nossa Senhora das Graças,Manaus,AM
FACULDADE DO BAIXO PARNAÍBA (FAP),FAP,Avenida Ataliba Vieira de Almeida - 1.452 Centro,Chapadinha,MA
FACULDADE DO BELO JARDIM (FBJ),FBJ,Sítio Inhumas - s/n Zona Rural,Belo Jardim,PE
Faculdade do Bico do Papagaio (FABIC),FABIC,Rua Planalto - S/n Setor Augustinópolis,Augustinópolis,TO
FACULDADE DO CARIRI PARAIBANO (UNICIR),UNICIR,BR 412 - KM 105 Sítio Novo Oriente,Sumé,PB
FACULDADE DO CENTRO EDUCACIONAL MINEIRO - FACEM (FACEM-BH),FACEM-BH,Rua Eufrates - 30 Alípio de Melo,Belo Horizonte,MG
FACULDADE DO CENTRO EDUCACIONAL SANTA ISABEL (FACESI),FACESI,Estrada da Branquinha - 299 Viamópolis,Viamão,RS
FACULDADE DO CENTRO LESTE (UCL),UCL,Rodovia ES-010 - S/N Manguinhos,Serra,ES
Faculdade do Centro Leste - Cariacica (UCL),UCL,Rua Bolívia - S/N Jardim América,Cariacica,ES
Faculdade do Centro Maranhense (FCMA),FCMA,AVENIDA ROSEANA SARNEY - 151 TRIZIDELA,Barra do Corda,MA
Faculdade do Centro Oeste Paulista (FACOP),FACOP,R. Luiz Gimenez Macegoze - 72 Distrito Industrial,Piratininga,SP
Faculdade Docktor (FADOCKTOR),FADOCKTOR,Rua Cel. Domiciano - 121 Centro,Muriaé,MG
FACULDADE DO CLUBE NÁUTICO MOGIANO (FCNM),FCNM,Rua Cabo Diogo Oliver - 758 Mogilar,Mogi das Cruzes,SP
Faculdade do Complexo Educacional Santo André (FACESA),FACESA,Rua Doutor Luis Carlos - 3439 Novo Horizonte,Açu,RN
Faculdade Doctum da Serra (DOCTUM),DOCTUM,Rua Chopin - 357 Parque Residencial Laranjeiras,Serra,ES
Faculdade Doctum de Carangola (DOCTUM),DOCTUM,Avenida Machado de Assis - 172 Triangulo,Carangola,MG
Faculdade Doctum de João Monlevade (DOCTUM),DOCTUM,Rua 16 - 24 VILA TANQUE,João Monlevade,MG
Faculdade Doctum de Juiz de Fora (DOCTUM),DOCTUM,Estrada Dom Orione - s/n Dom Bosco,Juiz de Fora,MG
FACULDADE DOCTUM DE MANHUAÇU - DOCTUM (FCM),FCM,Avenida Getúlio Vargas - 700 Bairro Coqueiro,Manhuaçu,MG
Faculdade Doctum de Serra (DOCTUM),DOCTUM,Rua 1 D - 80 Civit II,Serra,ES
Faculdade Doctum de Vila Velha (DOCTUM),DOCTUM,Rua Lúcio Bacelar - 490 Praia da Costa,Vila Velha,ES
Faculdade Doctum de Vitória (DOCTUM),DOCTUM,Rua Joaquim Leopoldino Lopes - 230 Consolação,Vitória,ES
FACULDADE DO DISTRITO FEDERAL (FACDF),FACDF,Quadra QNN 1 Conjunto H - 04 Ceilândia Norte (Ceilândia),Brasília,DF
Faculdade do Educador (FEDUC),FEDUC,Avenida Ibirapuera - 2657 Indianópolis,São Paulo,SP
FACULDADE DO ESPÍRITO SANTO (FACES),FACES,Avenida Nossa Senhora da Penha - 1800 Barro Vermelho,Vitória,ES
FACULDADE DO ESPÍRITO SANTO (UNES),UNES,Rua Moreira - 23 Independência,Cachoeiro de Itapemirim,ES
FACULDADE DO ESTADO DO MARANHÃO (FACEM),FACEM,Alameda D - 5 Quitandinha,São Luís,MA
FACULDADE DO FUTURO (FAF),FAF,Rua Duarte Peixoto - 259 Coqueiro,Manhuaçu,MG
FACULDADE DO GUARUJÁ (FAGU),FAGU,Via Santos Dumont - 3365 Jardim Boa Esperança,Guarujá,SP
FACULDADE DO INSTITUTO BRASIL (FIBRA),FIBRA,Rodovia BR-153/060 - 3400 Zona Urbana,Anápolis,GO
FACULDADE DO INSTITUTO NACIONAL DE PÓS-GRADUAÇÃO DE CAMPINAS (FAC. INPG - CAMPINAS),FAC. INPG - CAMPINAS,Avenida Manuel Afonso Ferreira - 245 Jardim Paraiso,Campinas,SP
FACULDADE DO INSTITUTO NACIONAL DE PÓS-GRADUAÇÃO DE SÃO JOSÉ DOS CAMPOS (FACULDADE INPG - SJC),FACULDADE INPG - SJC,Avenida Alfredo Ignácio Nogueira Penido - 678 Parque Residencial Aquarius,São José dos Campos,SP
Faculdade do Instituto Panamericano (FACIPAN),FACIPAN,Avenida Dom Bosco - 1460 Centro Sul,Cuiabá,MT
Faculdade do Instituto Pecege (IPECEGE),IPECEGE,Rua Alexandre Herculano - 120 Vila Monteiro,Piracicaba,SP
FACULDADE DO INSTITUTO SUPERIOR DE EDUCAÇÃO - ISE (ISE),ISE,Avenida Desembargador Clotário Portugal - 933 Centro,Campo Largo,PR
FACULDADE DO INTERIOR PAULISTA (FIP),FIP,Avenida Narcisa Chesini Ometto - 3.555 Portal da Barra,Barra Bonita,SP
FACULDADE DOIS DE JULHO (F2J),F2J,Avenida Leovigildo Filgueiras - 81 a 85 Garcia,Salvador,BA
FACULDADE DO LITORAL PARANAENSE (FLP),FLP,Rua Joaquim Menelau de Almeida Torres - 101 Piçarras,Guaratuba,PR
FACULDADE DO LITORAL SUL PAULISTA (FALS),FALS,Rua Marechal Eurico Gaspar Dutra - 836 Canto do Forte,Praia Grande,SP
Faculdade do Maciço do Baturité (FMB),FMB,Rua Edmundo Bastos - s/n Sanharão,Baturité,CE
FACULDADE DOM ALBERTO (FDA),FDA,Rua Ramiro Barcelos - 892 Centro,Santa Cruz do Sul,RS
FACULDADE DO MARANHÃO (FACAM-MA),FACAM-MA,Rua Trinta e Oito - Lote 03 Bequimão,São Luís,MA
FACULDADE DOM BOSCO (DOM BOSCO),DOM BOSCO,Avenida das Torres - 500 Loteamento FAG,Cascavel,PR
FACULDADE DOM BOSCO DE CAPITÃO LEÔNIDAS MARQUES,-,"Avenida Tibagi, quadra 59, lotes de 1 a 10 - Centro",Capitão Leônidas Marques,PR
FACULDADE DOM BOSCO DE GOIOERÊ (DOM BOSCO GOIOERÊ),DOM BOSCO GOIOERÊ,Rua Andirá - 565 Jardim Curitiba,Goioerê,PR
FACULDADE DOM BOSCO DE MARINGA (DOM BOSCO),DOM BOSCO,Avenida Advogado Horácio Raccanello Filho - 5415 Zona 10,Maringá,PR
FACULDADE DOM BOSCO DE PORTO ALEGRE (FDB),FDB,Rua Marechal José Inácio da Silva - 355 Passo D'Areia,Porto Alegre,RS
FACULDADE DOM BOSCO DE UBIRATÃ (DOM BOSCO UBIRATÃ),DOM BOSCO UBIRATÃ,Avenida Clodoaldo de Oliveira - 1.117 Centro,Ubiratã,PR
FACULDADE DO MÉDIO PARNAÍBA,-,Rua 18 de Setembro - 293 Centro,São Pedro do Piauí,PI
FACULDADE DOM LUCIANO MENDES (FDLM),FDLM,"Rodovia dos Inconfidentes, Km 108 - s/n Chácara",Mariana,MG
FACULDADE DOM LUIS DE ORLEANS E BRAGANÇA (FARRP),FARRP,Br-110- Km 07 Ribeira do Pombal - s/n Pombalzinho,Ribeira do Pombal,BA
Faculdade Dom Pedro II de Barreiras (DP II Barreiras),DP II Barreiras,Rua Dom Pedro II - 63 Centro,Barreiras,BA
Faculdade Dom Pedro II de Jequié (DP II),DP II,Rua Padre Altino Freire - 63 Centro,Jequié,BA
Faculdade Dom Pedro II de Sergipe (DP II Sergipe),DP II Sergipe,Praça Nossa Senhora Aparecida - 40 Cidade Nova,Lagarto,SE
FACULDADE DOM PEDRO II DE TECNOLOGIA (FAB),FAB,Praça da Inglaterra - 6 Comércio,Salvador,BA
Faculdade Dom Pedro II - Luis Eduardo Magalhães (FDP II LEM),FDP II LEM,Rua Glauber Rocha - s/n Loteamento Jardim Paraíso,Luís Eduardo Magalhães,BA
FACULDADE DOM RICARDO (FDR),FDR,Avenida Salgado Filho - 3025 Centro,Guarulhos,SP
FACULDADE DOMUS SAPIENS (FDS),FDS,Rua Quatro - S/N Alto da Maravilha,Juazeiro,BA
FACULDADE DO NORDESTE DA BAHIA (FANEB),FANEB,Rua Dr. Carvalho de Sá - s/n Centro,Coronel João Sá,BA
FACULDADE DO NOROESTE DE MINAS (FINOM),FINOM,"Rodovia MG 188, km 167. Fazendinha. Caixa Postal. - s/n Fazendinha",Paracatu,MG
Faculdade do Norte de Mato Grosso (AJES),AJES,Rua Oitys - 150 Jardim Vitória,Guarantã do Norte,MT
FACULDADE DO NORTE GOIANO (FNG),FNG,Rua 06 - 21 Setor Leste,Porangatu,GO
FACULDADE DO NORTE NOVO DE APUCARANA (FACNOPAR),FACNOPAR,Avenida Zilda Seixas Amaral - 4350 Parque Industrial Norte,Apucarana,PR
FACULDADE DO PANTANAL MATOGROSSENSE (FAPAN),FAPAN,Avenida São Luiz - 2522 Cidade Nova,Cáceres,MT
FACULDADE DO PIAUÍ (FAPI),FAPI,Rua Walfran Batista - 91 São Cristóvão,Teresina,PI
FACULDADE DO PLANALTO CENTRAL (FAPLAC),FAPLAC,PRAÇANOSSA SENHORA DA CONCEIÇÃO - 284 CENTRO,Formosa,GO
FACULDADE DO RECIFE (FAREC),FAREC,Rua Dom Bosco - 1367 Boa Vista,Recife,PE
FACULDADE DO RIO DE JANEIRO,-,Rua General Caldwell - 189/197 Centro,Rio de Janeiro,RJ
FACULDADE DOS CARAJÁS,-,"FOLHA 32 QD.16 LOTE, - 02 NOVA MARABÁ",Marabá,PA
FACULDADE DOS CERRADOS PIAUIENSES (FCP),FCP,Avenida Joaquina Nogueira de Oliveira - S/N Aeroporto,Corrente,PI
FACULDADE DO SERIDÓ (FAS),FAS,Rua Prefeito Alcindo Gomes - 679 Manoel Salustino,Currais Novos,RN
FACULDADE DO SERTÃO BAIANO (FASBE),FASBE,Av Antonio Carlos Magalhães - 12 centro,Monte Santo,BA
Faculdade do Sertão Central (FASEC),FASEC,"rodovia BR 226, km 67 - s/nº centro",Milhã,CE
FACULDADE DO SERTÃO DO ARARIPE (FASA),FASA,"RUA MARIANA PENHA EVANGELISTA, - S/N CENTRO",Trindade,PE
FACULDADE DO SERTÃO DO PAJEÚ (FASP),FASP,Rua Doutor Osvaldo Gouveia - S/N CENTRO,Afogados da Ingazeira,PE
FACULDADE DO SERTÃO DO SÃO FRANCISCO (FASF),FASF,Rua da Matriz - s/n Beira Rio,Cabrobó,PE
Faculdade dos Guararapes (FG),FG,Avenida Governador Carlos de Lima Cavalcanti - 110 Boa Vista,Recife,PE
FACULDADE DOS PALMARES (FAP),FAP,Avenida Coronel Pedro Paranhos - 290 Centro,Palmares,PE
FACULDADE DO SUDESTE GOIANO (FASUG),FASUG,Avenida Lino Sampaio - 79 Centro,Pires do Rio,GO
FACULDADE DO SUL,-,Avenida José Soares Pinheiro - 1600 Centro,Itabuna,BA
FACULDADE DO SUL DA BAHIA (FASB),FASB,Rua Sagrada Família - 120 Bela Vista,Teixeira de Freitas,BA
FACULDADE DO TAPAJÓS (FAT),FAT,Rua Transamazônica - 479 Bela Vista,Itaituba,PA
FACULDADE DO TRABALHO (FATRA),FATRA,Avenida Paes Leme - 485 Osvaldo Rezende,Uberlândia,MG
FACULDADE DOURADO (FD),FD,Rua Nhatumani 556-568 - 568 Vila Ré,São Paulo,SP
FACULDADE DOUTOR FRANCISCO MAEDA (FAFRAM),FAFRAM,Rodovia Jerônimo Nunes Macêdo Km 01 - s/n Aeroporto,Ituverava,SP
FACULDADE DOUTOR LEOCÁDIO JOSÉ CORREIA (FALEC),FALEC,Rua José Antônio Leprevost - 331 Santa Cândida,Curitiba,PR
Faculdade do Vale do Caju (FVC),FVC,"Loteamento ?Novo Pacajus?, BR 116, Lote 48 a 50, no Bairro Pedra Branca, Pacajús-Ceará - s/nº edra Branca",Pacajus,CE
FACULDADE DO VALE DO ITAJAÍ MIRIM (FAVIM),FAVIM,Rua Gregório Diegoli - 35 São Luiz,Brusque,SC
FACULDADE DO VALE DO ITAPECURÚ (FAI),FAI,Rua Bom Pastor - 425 Centro,Caxias,MA
FACULDADE DO VALE DO JAGUARIBE (FVJ),FVJ,"Rodovia CE-040, Km 138 - Aeroporto",Aracati,CE
FACULDADE DO VALE DO RIO ARINOS (AJES),AJES,Rua Nelson Aparecido Fragnan - S/N Jardim Universitário,Juara,MT
Faculdade do Vale do São Francisco (FAVASF),FAVASF,Avenida Barão do Rio Branco - 812 Centro,Petrolina,PE
FACULDADE DO VALE ELVIRA DAYRELL - FAVED (FAVED),FAVED,Rodovia de Ligação da Br 259 À Br 120 - s/n Centro,Virginópolis,MG
FACULDADE DUARTE COELHO (FDC),FDC,PE-90 - s/n Loteamento Maracajá,Surubim,PE
FACULDADE EASE BRASIL (EASE),EASE,Rua José Hipólito - 1240 Messejana,Fortaleza,CE
Faculdade Educacional Araucária (Facear),Facear,Rua Jatobá - 569 Eucaliptos,Fazenda Rio Grande,PR
FACULDADE EDUCACIONAL ARAUCÁRIA (Facear),Facear,Rua Doutor Levy Buquéra - 589 Sitio Cercado,Curitiba,PR
FACULDADE EDUCACIONAL DA LAPA (FAEL),FAEL,Rodovia Olívio Belich Km 33 - 580 Boqueirão,Lapa,PR
FACULDADE EDUCACIONAL DE ARAPOTI (FATI),FATI,Rua das Rosas - 001 Residencial Inpacel,Arapoti,PR
FACULDADE EDUCACIONAL DE COLOMBO (FAEC),FAEC,Estrada da Ribeira - 270 Maracanã,Colombo,PR
FACULDADE EDUCACIONAL DE CORNÉLIO PROCÓPIO (FACED),FACED,"Pr 160, Km 04 - S/N Conjunto Universitário",Cornélio Procópio,PR
FACULDADE EDUCACIONAL DE FRANCISCO BELTRÃO (FEFB),FEFB,AV UNIÃO DA VITÓRIA - 14 MINIGUAÇU,Francisco Beltrão,PR
FACULDADE EDUCACIONAL DE MATELÂNDIA (FAMA),FAMA,Rua Marechal Floriano - 964 Centro,Matelândia,PR
FACULDADE EDUCACIONAL DE MEDIANEIRA (UDC Medianeira),UDC Medianeira,Rua Rio Branco - 1820 CENTRO,Medianeira,PR
FACULDADE EDUCACIONAL DE PONTA GROSSA,-,Rua Tibúrcio Pedro Ferreira - 55 Centro,Ponta Grossa,PR
FACULDADE EDUCACIONAL JURÍDICA E GERENCIAL DE OLIVEIRA (FEJUGO),FEJUGO,Rua Benjamim Guimarães - 27 Centro,Oliveira,MG
FACULDADE EDUCACIONAL MILLENNIUM (FAMIL),FAMIL,Rua Luís Torres - 354 Maraponga,Fortaleza,CE
Faculdade Educamais (EDUCA+),EDUCA+,Rua Dr. Luiz Carlos - 1000 Penha,São Paulo,SP
Faculdade EduCareMT (EDUCARE),EDUCARE,Rua Rio da Casca - 18 Grande Terceiro,Cuiabá,MT
FACULDADE EDUVALE DE AVARÉ (EDUVALE),EDUVALE,Avenida Pref. Misael Euphrasio Leal - 347 Jardim América,Avaré,SP
FACULDADE EFICAZ (FACULDADE EFICAZ),FACULDADE EFICAZ,Avenida Duque de Caxias - 882 Zona 07,Maringá,PR
FACULDADE EGAS MONIZ (FEM),FEM,Rua João Cardoso Aires - 955 Boa Viagem,Recife,PE
FACULDADE EINSTEIN,-,Rua a Quadra D Lote 26 - S/n Stella Maris,Salvador,BA
